{"activatedAt":"2026-08-12T14:15:23.867543Z","activationSetId":"pact_d07b17ef0e339abb","activeSelectionIds":["rsel_10cadb8fbae7956c"],"audience":"response_rich_local","bundleId":"pb_89d9518d833b885efecf","bundleSemanticFingerprint":"89d9518d833b885efecf55307e972f904022a386346c3cc53160a1b8b3f08124","environment":"local","predecessorActivationSetId":null,"retailerId":"retailer-demo","schemaVersion":"retail-pricing-activation-set/v1","tenantId":"tenant-demo"}
